{
  "foreignDividend":[
    {
      "countryCode":"FRA",
      "amountBeforeTax":1999.99,
      "taxTakenOff":1999.99,
      "specialWithholdingTax":5000.99,
      "foreignTaxCreditRelief":false,
      "taxableAmount":5000.99
    }
  ],
  "dividendIncomeReceivedWhilstAbroad":[
    {
      "countryCode":"FRA",
      "amountBeforeTax":1999.99,
      "taxTakenOff":1999.99,
      "specialWithholdingTax":5000.99,
      "foreignTaxCreditRelief":false,
      "taxableAmount":5000.99
    }
  ],
  "stockDividend": {
      "customerReference":"Stock dividend income",
      "grossAmount":5000.99
    },
  "redeemableShares": {
    "customerReference":"Redeemable shares income",
    "grossAmount":5000.99
  },
  "bonusIssuesOfSecurities": {
    "customerReference":"Bonus Securities",
    "grossAmount":5000.99
  },
  "closeCompanyLoansWrittenOff": {
    "customerReference":"Written off",
    "grossAmount":5000.99
  }
}